id,subreddit,submission_id,score,comment_body
lqx4jgr,Gunners,1fywbkq,0.6,"I was there from Australia. I screamed so fucking loud to the sky when that went in. 


One of my top 5 moments."
lqx4i71,Gunners,1fywbkq,0.75,"I know Martinelli gets a lot of shit every time he goes through a tough patch of form, but honestly the guy is clutch… pretty much always turns up in big games, or big points in matches that aren’t going our way… and his effort levels are off the charts even when he’s not contributing G/A."
lqx2lm9,Gunners,1fywbkq,0.7,despite our somewhat poor run of form around this time period this win was pivotal in how good we’ve been away from home this year. i know this game was at home but it gave those players belief that they could win anywhere no matter what.
lqx2nzn,Gunners,1fywbkq,0.1,We making City score for us!!
lqx9x2i,Gunners,1fywbkq,-0.5,"Man city players: you need to have winning mentality


Number of wins man city had against us past 2 seasons: 0"
lqx4sxo,Gunners,1fywbkq,1.0,Partey-Tomi-Kai-Gabi-Ake-BAAAAANG
lv6nkw9,coys,1giod9h,-0.5,You'll never sing that...
lv6pfr4,coys,1giod9h,-0.5,Sub faker on and we win ngl
lv6pky8,coys,1giod9h,-0.7,"Fucks sake ange, u can’t do this in front of the goats"
lv77rkj,coys,1giod9h,1.0,"Not gonna lie. The comments on this thread are cracking me up.

All versions of the ""This is embarrassing"" to ""Nevermind. I was wrong.""

Love this sub after a brilliant win lol."
lv6o5sv,coys,1giod9h,0.2,"Sorry for the sad display, my goat.

EDIT: Nevermind we're so back."
lv6one4,coys,1giod9h,-0.9,EMBARRASSING ME IN FRONT OF THE HOES
lv6xx0s,coys,1giod9h,-0.5,Faker is contagious
lv6mpa7,coys,1giod9h,0.0,[https://x.com/T1LoL/status/1853083918926573750](https://x.com/T1LoL/status/1853083918926573750)
lv6rqrr,coys,1giod9h,0.0,T1 Hotspur when
lv7hzel,coys,1giod9h,0.6,Now show us a Faker and Son photo. I’m also impressed how many football fans know who Faker is.
ltkpe6e,coys,1gbcqtj,0.9,"Great leadership in that moment, making the team bigger than himself."
ltkq88v,coys,1gbcqtj,0.9,"Good from Madders, richy needs that confidence. It’s even great from madders to put team before anything. Respect."
ltkt1af,coys,1gbcqtj,-0.5,At least this didn’t turn into the Chelsea situation🤮🤮🤮
ltkq3aa,coys,1gbcqtj,0.6,Felt the captain’s armband on his shoulder and decided to be the bigger man
ltkscur,coys,1gbcqtj,0.2,"Richarlison used ""insist""."
ltkszei,coys,1gbcqtj,1.0,"We’re so lucky to have so many capable and strong onfield leaders.

Son, Romero, Maddison, vicario, Davies, kulu are all wonderful"
ltkyrxf,coys,1gbcqtj,1.0,"the tug on his armband to me says “what would a leader do in this situation”

a leader would look out for his guy as best he could after he’s been down a hard road, and that’s what he did. guys first start back, he’s been working hard. get him on the scoresheet. 

did it jeopardize the W? maybe. did it reinforce what’s been building in N17 since last season? absolutely. 

cheers to the vice-captain, and welcome back pombo. 

COYS"
ltkquw4,coys,1gbcqtj,0.7,Small gesture with a huge meaning.
ltksd8e,coys,1gbcqtj,0.5,I'm kind of surprised that people are assuming Richy took the ball off Maddison originally and not the other way around. I don't think Maddison would've been designated the taker over Richy really.
ltkteel,coys,1gbcqtj,0.8,This is actually really impressive
luo12vw,coys,1gg9xqc,0.9,This is fucking hilarious lol.
luo1dlr,coys,1gg9xqc,0.5,"Their starting XI was strong, everyone apart from McAtee and O'Reilly could start a big game for them and no one would bat an eyelid, then they brought on Kovacic, Bernardo, Gvardiol as well. Obviously it's not full strength but it's still strong. We played all of the match or large portions without VdV, Romero, Son, Porro so it's not like we were full strength either."
luo1nxx,coys,1gg9xqc,-0.6,"They started two kids, subbed on two, and didn't play Haaland. That definitely doesn't negate starting Ake, Diaz, Stones, Gundo, Foden, and Savinho. They also subbed on a 90 million pound left back for Christ sake."
luo30b1,coys,1gg9xqc,0.5,Just realised 5 of our starters are younger than Foden lol
luo12b9,coys,1gg9xqc,0.5,What a stat - Spurs yoof represent!
luo30g8,coys,1gg9xqc,-0.5,"Sky loves a narrative, even if it's complete bollocks"
luo16as,coys,1gg9xqc,-0.6,"Nooo you don’t get it though, city practically played their U15s!!!! !! And pep doesn’t even care so it doesn’t even matter!!"
luo1bbd,coys,1gg9xqc,0.6,"Although ours is still younger, 23 didn't quite fit in my imaginary.

It was 24.8 vs 26, with Werner and Vicario being the ""eldest"" with 28.

This made me realise Kulu is only 24 😮😮 It feels he's been 30 for decades, he has such an experienced player vibes."
luog3gt,coys,1gg9xqc,-0.6,"Over here in America, the bias of the commentators towards Man City was pretty apparent to me. Every one of their players was discussed as if they were, to a man, Ballon d’Or nominees."
luo1za5,coys,1gg9xqc,0.2,"My app shows that average age of mc was 26, ours  24.8. But the main factor was the number of teenagers. Mc had 2, we had one. In the second half they had 4, we had 2. Yes, they had more teenagers, it’s true. But in general teams were comparable in age."
lu0xjj3,coys,1gde8v6,-0.7,Tough to swallow when you see those boys walking around with 3 minutes left. No urgency whatsoever.
lu0xpvt,coys,1gde8v6,-0.9,That game was gross. Sloppy in possession. No real attacking ideas. Bunch of long balls that were low quality. Terrible effort and got the 0 points they deserved.
lu0xlpj,coys,1gde8v6,-0.5,Went from my most anticipated game of the season to the most frustrating game of the season
lu0yrmt,coys,1gde8v6,-0.9,"Nobody fucking tried today. They just jogged around for 90 fucking minutes to collect their 100k for the week.

If they don't fucking try, if they don't care about the badge then why the fuck do I bother watching them?"
lu0xj30,coys,1gde8v6,-0.9,Too many losses.....wayyyy too many losses
lu0xngl,coys,1gde8v6,-1.0,That was abysmal
lu0xkk4,coys,1gde8v6,-0.6,What’s with Romero looking so passive this season man - a lot more in that game going wrong than just one player but he just seems off
lu0xqst,coys,1gde8v6,-0.5,Dr Tottenham. 4 wins and 4 losses should be unacceptable. Beating AZ level teams in between should not be enough to cover up these Pl performances.
lu0xvov,coys,1gde8v6,-0.9,Everyone looked disinterested. Some of the worst passing and first touches I’ve seen from this squad.
lu0y353,coys,1gde8v6,-0.6,Sadly we're a mid table team who is nice to watch as a neutral but ultimately pointless.
lvdhhky,coys,1gjj5c3,0.25,He smiles?
lvdhq5d,coys,1gjj5c3,0.4,"LOL! You lot, calm down while I enjoy myself!!"
lvdh4ej,coys,1gjj5c3,-0.5,Why is he calming them down?
lvdioby,coys,1gjj5c3,-0.5,madders looks like he surprised himself with how quickly he took that
lvdl51y,coys,1gjj5c3,0.9,i think ange enjoyed seeing madders take it so quickly as much as we did. feels very in the spirit of how ange likes to see them play.
lvdobkx,coys,1gjj5c3,0.7,"Definitely a “no need to keep pressing” hand gesture at the end.   Ange only smiles when he knows we are definitely going to win….aka up 4-1 with 1 minute left.

A true Spurs fan."
lvdif9x,coys,1gjj5c3,0.9,Proud grandad
lvdj3h6,coys,1gjj5c3,0.5,"lol the “relax, relax” afterwards"
lvdq3xm,coys,1gjj5c3,-0.5,"So you see, that's where the trouble began... That smile, that damned smile."
lvdihlk,coys,1gjj5c3,1.0,What a contagious smile!
lu8xcpt,MCFC,1gee3zc,0.6,I never thought I would live to see a city player win the Ballon D’or
lu8xlwl,MCFC,1gee3zc,0.9,The first ever Man City player to win a Ballon D’or 😭😭😭😭
lu8x8n1,MCFC,1gee3zc,0.75,LET‘S GOOOOOOOOOOOOOOOO
lu8xrtz,MCFC,1gee3zc,-0.6,"Of all the incredible players we've had over the last fifteen years, it's a DM who wins the balloon. Well deserved, but kinda crazy. Aguero, Silva, De Bruyne, not good enough."
lu8xf59,MCFC,1gee3zc,0.9,YESSSSSS WE FINALLY DID IT MANCHESTER CITY. RODRIIIIIIIII.
lu8xe8t,MCFC,1gee3zc,-0.5,Take it to CAS Madrid
lu8x8vy,MCFC,1gee3zc,0.5,Congratulations Rodri.
lu8xbpq,MCFC,1gee3zc,0.7,that's my goat
lu8xaio,MCFC,1gee3zc,0.6,who else has tears in their eyes right now
lu8xw8e,MCFC,1gee3zc,0.9,The club's gone up a level this year. This will mean more than a trophy for the club in terms of stature.
luc58hw,MCFC,1gerr1s,1.0,Kun coming in with another beautiful finish!
luckgv0,MCFC,1gerr1s,0.2,"https://preview.redd.it/1sb55g0japxd1.jpeg?width=960&format=pjpg&auto=webp&s=b7bf19947971acbe00837e864e901987d3166d65

It’s started guys"
luc4f3m,MCFC,1gerr1s,-0.5,Here comes all the Madrid fans saying fuck Kun Ronaldo better than him like bruh shut up Madrid fans cry to much bruh
lucb40c,MCFC,1gerr1s,-0.7,That's my biggest gripe with Madrid. The entitlement is astounding.
luci8yu,MCFC,1gerr1s,-0.5,This is so petty imagine any other club did this or if the haaland did this last year or Lewandowski did it 2021
lud8dkd,MCFC,1gerr1s,-0.9,"I hope Real Madrid do not think they can still sign Rodri after this snub. Short sighted entitled brats, all the better for us"
luc4g6c,MCFC,1gerr1s,-1.0,Like fuck Madrid and they’re whole fam base and players and club
lud310p,MCFC,1gerr1s,0.6,"I remember when the Madrid media used to parrot the same line every year, that Aguero only joined City as a stepping stone because Atleti wouldn't sell him direct.

Love that it's a future Atleti boy that has ""stolen"" the Balon d'Or from them."
luc5xb2,MCFC,1gerr1s,0.5,King Kun
lucfeg9,MCFC,1gerr1s,-0.5,Agueroooooooo from the top rope. Fuck Madrid
lumzcbv,MCFC,1gg3hxz,-0.5,"Madrid is acting like a bunch of entitled pricks. Sure Vini had a good season but he completely disappeared for Brazil, but no one can see that"
lun7x74,MCFC,1gg3hxz,-0.5,"Not only Vinicius disappeared in the copa , he didn't perform well in the league. He is eighth in terms of goals and not even top ten in assists and is being touted as la liga best player

https://preview.redd.it/06iy7kxtl0yd1.jpeg?width=664&format=pjpg&auto=webp&s=81fd574244fc630d5eb63acd9e244170e7ce330c"
lumtivp,MCFC,1gg3hxz,-1.0,"Real Madrid being victim

![gif](giphy|65ODCwM00NVmEyLsX3)"
lun0baf,MCFC,1gg3hxz,0.0,"that was such a wild balon dor voting. deep this. LIONEL FUCKING MESSI finished 5th... it truly was a corruption. it truly made me realize balon dor is all about trophies won, PR, and what not. Rodri winning is truly a massive justice for football. it reminded everyone what the balon dor is truly about. individual performances over the season and rodri has been the best player in the world. 



https://preview.redd.it/gc00xhmlc0yd1.jpeg?width=1152&format=pjpg&auto=webp&s=51e5e66773e5d9252dd23d96f21f2ce1d193eb60"
lumr5hd,MCFC,1gg3hxz,0.2,Other teams don't play the victim card.
lunjarc,MCFC,1gg3hxz,0.6,"The performance of this man as  DM over that 63 match stretch isnt being talked enough. 

This lad was a rock in his defensive/ game control and organisation role. 

But the influence he had overall that number of assists and goals scored and how he impacted his side were a on a level of a  Ballon d'Or highest standards.

This one and Cannavaro's after the 2006 WC are probably the less flashy winners in the last 20 years. Maybe sure.

Ronaldinho did absolute magic and made people foam from the mouth in awe every 4 days at his very best yes.

Sure we all like attack minded football, celebrate and praise when a generational talent bangs in 50 goals in a season. The gong is well deserved in that case 100%

Rodri and Cannavaro's were two brutally legendary performances of two defensive footballers.

They played at the peak of their powers and their craft in their Ballon  d'Or seasons. They had an influence of such magnitude on their sides achieving a WC and a Euro. 

Spain was an utter shambles of a side before the last Euro. And this lad was a pillar in that champion side.

So anyone questionning this man's merit in this you can go fuck yourselves and go cry somewhere we dont hear you weeping.

This is a fucking gem of a generational footballer. Let's just enjoy him."
lun5px2,MCFC,1gg3hxz,1.0,"I’m happy for Rodri and City fans. Really deserved. 

It’s nice seeing non-attackers get their flowers."
luobzjv,MCFC,1gg3hxz,0.6,"Correct me if I’m wrong but I feel they seem to forget in that season, we were unbeaten in 55 games when Rodri played until we lost to Man United in the FA cup. No other player in Europe has had that much impact on a team."
lunap6x,MCFC,1gg3hxz,-0.8,Modric was good that year but pretending Messi didn't exist and that Modric played better than him is the biggest robbery in ballon d'Or I've seen
luo82rh,MCFC,1gg3hxz,-0.6,"Look I’ll be brutally honest, yes Vini won the ucl with Madrid and yes he was arguably their best player….but why are they going on like that ucl victory was the greatest achievement ever? For a champions league campaign it was pretty average, they won through grit not just a one man show. 

On top of that he was slightly above average in the league and way below average internationally. 

They’d be better off complaining Bellingham didn’t win because honestly I think he was more important to Madrid and England this season"
lu9hsey,MCFC,1geghiq,0.2,"Levels to this shit. One club in Manchester has a player winning the Ballon d’or, the other is sacking their coach after a humiliating loss. Levels."
lu9yb3s,MCFC,1geghiq,0.25,"👏🏻❤️

https://preview.redd.it/oj32ovsfilxd1.jpeg?width=3763&format=pjpg&auto=webp&s=88b84040386c2eff63f73456a50cab13fcb0e005"
lu9jmz2,MCFC,1geghiq,1.0,"This has to feel so good after his injury, can’t wait for this legend to come back"
lu9gsnx,MCFC,1geghiq,0.5,Hell yeah
lu9ovmd,MCFC,1geghiq,0.6,Statue guaranteed
lu9gy9n,MCFC,1geghiq,0.5,Legend
lu9s325,MCFC,1geghiq,0.9,He's already becoming iconic. I hope he stays in City till he retires.
lu9vktk,MCFC,1geghiq,0.4,I really wanted more city players to be there in the ceremony.
luaijqq,MCFC,1geghiq,0.6,There were tons of rumours about him going to Madrid this off-season. Hope this solidifies him staying here the rest of his career.
lua9nwf,MCFC,1geghiq,0.1,"![gif](giphy|r42HxBImuzoRxsRA14)

Rodri in his next contract negotiations"
lt1dfw4,MCFC,1g8vhd9,-0.3,"Ono 6 foot keeper got bodied by ""Bernardo Silva""🤣"
lt1i30e,MCFC,1g8vhd9,0.0,https://preview.redd.it/pzir3ev5f5wd1.jpeg?width=1035&format=pjpg&auto=webp&s=63471199aa5e514ccce290ec406e3932665fe646
lt1jd5o,MCFC,1g8vhd9,-0.5,Tell ‘em to cry on our silverware to keep it clean
lt1ki20,MCFC,1g8vhd9,0.5,You should post this in the r/soccer subreddit as well. 😂😂
lt1vxv9,MCFC,1g8vhd9,-0.6,"Shithouse team. White, Gabriel and Saliba manhandle players constantly and nothing happens. 

Anyone bleating about this goal needs to look up the definition of infringement. Not offside when the corner is played and disengages before Stones heads it."
lt1qvtt,MCFC,1g8vhd9,-0.9,"Arsenal fans have always been gobshites who want to be the moral guardians of sport but always been a bunch of dirty cunts on the pitch ""oh we're the arsenal and we have a marble entrance and our captain decides the length of shirt sleeves, aren't we special"""
lt2612i,MCFC,1g8vhd9,0.5,"Gooner all-encompassing strategy on right corners:

1) Saka bend towards the far post
2) everyone rush the goal/goalkeeper
3) inexplicably never get called for interference 

Genius."
lt2d8a1,MCFC,1g8vhd9,-0.9,"They’ve quickly become the most intolerable fan base. Was United and Chelsea, but the constant bottling has made them deranged and insufferable"
lt1hmyd,MCFC,1g8vhd9,-0.5,"Arsenal, logic, something's not right about those 2 words being used in the same sentence"
lt1ru1r,MCFC,1g8vhd9,-0.9,Don't you love how everything in the Prem is being rigged on behalf of City? Since we're such noted Premier League darlings and all.
ltw60de,Everton,1gcs5me,0.7,"I know a ton of people don't rate him, but I'd much rather have players like this around the club than blasé people looking for a step up or a payday. That attitude is contagious."
ltw4ucf,Everton,1gcs5me,0.0,🥹
ltwb7we,Everton,1gcs5me,-0.8,Watching DCL lose a header and then jog after the second ball compared to the work Beto was putting in was like night and day
ltwdgs8,Everton,1gcs5me,0.2,"While he still runs like a newly anesthetized baby moose, I will always love me some Beto!"
ltwg75i,Everton,1gcs5me,0.75,"I've only seen good things about Beto off-pitch, he seems like a great guy"
ltx5jh6,Everton,1gcs5me,0.5,"Don't think I've ever been more desperate for a striker to succeed at Everton.

You can tell it means so much to him whenever he scores and Goodison starts singing his name."
ltwqnrj,Everton,1gcs5me,0.9,They could never make me hate you
ltw7cbi,Everton,1gcs5me,-0.2,DCL look at this man. Beto deserves a start now surely
ltw9az2,Everton,1gcs5me,0.5,Gotta love the guy for who he is not how good he is..ole beto!
ltza6vi,Everton,1gcs5me,0.2,"Dominic Calvert-Lewin: 9 appearances, 2 goals, 1 assist, 767 total minutes this season in the Premier League 

Beto: 5 appearances, 1 goal, 52 total minutes in the Premier League. 

Really wouldn't kill Everton to let him start a few games."
lspcwmk,Everton,1g7arho,0.1,It’s not a meme!!
lsp2s3l,Everton,1g7arho,0.5,Now is my time!
lsozw4h,Everton,1g7arho,0.25,If only he didn’t have the pace of a snail…that finish tho 😮‍💨
lsozruv,Everton,1g7arho,0.2,Swap keane with dom….
lspazo1,Everton,1g7arho,0.0,He scores either way...
lss8s3v,Everton,1g7arho,0.3,Go with the Sean Dyche classic of 442 with DCL and Keane up front for a laugh innit.
lspesmr,Everton,1g7arho,-0.5,He’s always had an really good finish it’s mind bottling
lspskz5,Everton,1g7arho,0.5,Hes been comfortably better defensively than Tarkowski this season.
lspqwr7,Everton,1g7arho,0.5,Michael Keane is a centre back who's very good at finishing. He's not a striker
lsqjhiy,Everton,1g7arho,0.2,We don't play well without dom he keeps the shape
ltw24wy,Everton,1gcrs8s,0.6,Listening to his post match interview just makes me love him more. You can just hear his passion. I feel bad that he barely gets a look.
ltw4jpt,Everton,1gcrs8s,0.2,"Against lower teams and the highest teams I think Dom is a better player for the systems we face.

Against mid level clubs I like what chaos Beto brings to the games."
ltw1vk7,Everton,1gcrs8s,-0.5,He should definitely start over DCL
ltw36ns,Everton,1gcrs8s,-0.5,"Dcl has good overall play but he’s missed 3 or 4 clean through chances recently so might be best to make the change. Really should be winning games like today, we will soon run out of winnable games if not careful"
ltwn6la,Everton,1gcrs8s,0.9,"Say what you want but this is great for the team. Guys fighting for their place in the squad and the 11 and making the most of their chances.

Very very good for morale and overall competition."
ltxl4gs,Everton,1gcrs8s,0.9,"First of all, bravo to the OP: this is one of the best headlines I’ve ever read 😊👏🏼 

I’m happy for Beto as his passion has won me over like it has others, and I feel bad for him that Dyche has been stubborn with his system instead of experimenting to make the most of Beto, even if DCL is better overall. Now, if only we could pair Beto’s passion with Dom’s overall game, we’d have a world-beater 😝🤞🏼"
lu4pf72,Everton,1gcrs8s,-0.6,He is so under rated while DCL is so overrated. Dyche is afraid to make bold calls.
ltxpwu0,Everton,1gcrs8s,1.0,Long Live the King!
ltzm8fg,Everton,1gcrs8s,0.7,Would like us to find a way to play two up front with Beto & DCL. Think Keane being up front with Beto helped give their defence something else to think about but when DCL was up front alone he had two defenders on him all the time
lu09wlm,Everton,1gcrs8s,0.25,"I love Beto, but I don't think he has earned the starting spot. He is a fine super sub and a chaos agent against tired defenses. And he has the height to score goals like this one. But just watch him play - he puts in a ton of effort, but his fundamentals aren't there. He misses a lot of easy passes and his control is not good enough to play hold up. He is great to throw on exactly like Dyche did today against a tired team. He ran a ton, and his chaotic challenges and erratic movement actually seemed to work in our favor. He seems unpredictable to play against. Good on him and I hope he continues to make an impact off the bench, but Dom is so much more polished and it's clear. He'll get back into form, he played fine today"
lspnqiz,Everton,1g7db0w,0.6,"I was annoyed seeing him on the teamsheet today, but he proved me wrong."
lsptxod,Everton,1g7db0w,0.5,"He’s not good enough, but after he’s gone (whenever that might be) I’m going to choose to remember some of the great goals he’s scored rather than his poor defending. That Palace goal will live long in the memory."
lsqs377,Everton,1g7db0w,-0.6,Whoever scouted him as a defender has just denied us the greatest English goal scorer ever.
lsq8nrn,Everton,1g7db0w,-0.6,"I mean; its good to see, i just hope its permenant, because efc have seen this a ton

Keane plays well for two or three games,

Drops 11 stinkers in a row"
lsq3pd7,Everton,1g7db0w,0.4,When he makes it to five this season I’ll buy a kit
lsqkerg,Everton,1g7db0w,0.6,"Look, he’s been shit for the last 1.5 years or so, but he was solid when we needed him to be early on with us. He played through an injury where he could have lost his foot. He’s scored MANY crucial goals that have helped us stay in the prem. I am all about his redemption arc."
lspuaz6,Everton,1g7db0w,0.2,"Credit where credit is due, but he has to be consistent. When he's good, he's very good but he has too many scary games."
lsqbr9j,Everton,1g7db0w,0.5,Play him upfront
lsq0jxk,Everton,1g7db0w,0.1,Everyone knew who had written this post before clicking onto it
lsr88sd,Everton,1g7db0w,0.5,Keane is the man
lstvunb,Everton,1g7x4f7,0.3,"If he was quick he'd genuinely be a striker. He's always been good on the ball in fairness, his long passing is really good. Just wish he could actually defend. If he could get a move to a team that plays in a back 3 maybe it would help."
lstz11x,Everton,1g7x4f7,0.5,Target man
lsu6yvs,Everton,1g7x4f7,0.9,I am always very happy when he does well
lsv2hdr,Everton,1g7x4f7,0.6,I'm sure some people are going to get annoyed with the Keane memes. I am not one of those people.
lsv7nu6,Everton,1g7x4f7,0.5,Genuinely should be up front over DCL 😂
lsty40q,Everton,1g7x4f7,0.6,I like how you put Dixie’s curls on him.
lsx4j5h,Everton,1g7x4f7,0.0,Mixie Keane was right there
lsujryg,Everton,1g7x4f7,0.6,Have to admit seeing Keane in the starting line up yesterday was the first time I wasn’t worried
lsz33ly,Everton,1g7x4f7,0.5,Ffs! 😂🤜🤛
ltagg7u,Everton,1g7x4f7,0.2,"sometimes I do want to necromancy or time-travel Dean, whole team didn't score 60 goals last season and isn't on pace to do so this year either"
lv0u2x3,NUFC,1ghxpyh,0.2,TV announcer called this a Brazilian sandwich.
lv16i2v,NUFC,1ghxpyh,0.6,Can someone 3D print this so I can put it on the mantle piece
lv1alls,NUFC,1ghxpyh,-0.5,Got munched by Pope in the second half too
lv108ra,NUFC,1ghxpyh,-0.9,"Havertz is such an annoying cheating prick and sums up this Arsenal side. Constantly running into opponents with sly elbows and shoulder charges, doesn't go for the ball when it's in the air instead tries to hurt the opponent who is jumping for the ball, always looking to get his studs into the opponents, etc, and it's all done in a snide and sly manner where it's not blatant enough to be called a foul. Just a nasty POS and like I said it's how this Arsenal side operate. Glad to see our Brazilians boys and even Pope at one stage not put up with this twats antics."
lv1ari5,NUFC,1ghxpyh,0.5,Looks like a Dudley Boyz 3D if anyone remembers that..
lv2t94r,NUFC,1ghxpyh,-0.9,"That photo makes it look like Havertz was the victim. What actually happened was the dirty cheating prick launched in with his elbow out and Bruno just stepped out the way so Havertz went over the top. 

And then fell to the ground clutching his face like he’d been fouled. 

Arsehole. 


I don’t actually have much against most of the Arsenal squad. Arteta’s a whinging dickhead, but the rest are fine. 

Apart from Havertz and Partey, who are scum."
lv551z0,NUFC,1ghxpyh,0.6,"Joelinton makes the sando, gets the crowd yoked up after the free kick block, then immediately puts his hand up for the goalkick and gets hammered. Man earned his paycheck those two minutes 🫡🇧🇷"
lv1cjxv,NUFC,1ghxpyh,0.5,"0r: "" Avengers Assemble"""
lv2kri5,NUFC,1ghxpyh,-0.5,YOUVE SEEN UNITED
lv4u4pl,NUFC,1ghxpyh,0.6,Bruno and Big Joe. These men are beautiful.
lv2aomx,NUFC,1gi43or,0.9,We LIKE you too Bruno (like a lot)
lv2brf1,NUFC,1gi43or,1.0,"No matter what the future holds for Bruno at the club, he's already on the list of players that will be talked about and respected for years to come. You just know he'll be talked about reverently in 20 years time."
lv2e06r,NUFC,1gi43or,0.3,"He tweets how footballers used to tweet,  heritage"
lv2rmg3,NUFC,1gi43or,0.5,"BRUNOS FUCKING MAGIC

HE WEARS A MAGIC HAT

HE COULD HAVE SIGNED FOR ARSENAL

BUT HE SAID NO FUCK THAT

HE WANTS TO PLAY FOR EDDIE IN THE FAMOUS
BLACK AND WHITE

AND WHEN WE WIN THE PREMIER LEAGUE WE’LL SING THIS SONG ALL NIGHT"
lv2hl9t,NUFC,1gi43or,0.6,"Might not happen, but hope he’s here for a long time."
lv2xrfx,NUFC,1gi43or,-0.6,"Told my wife this tweet gave me butterflies. In the bad books now, never said that about her.."
lv2c39c,NUFC,1gi43or,0.9,I like him too. What a player he is. 🇧🇷
lv3lxfy,NUFC,1gi43or,0.9,"Some players just *get* Newcastle United. There’s a certain mindset, a certain link to the fans that not every player has. Even someone who plays brilliantly for us may not fully get it. 

Bruno 100% gets it."
