id,subreddit,submission_id,score,comment_body
lsvnc2y,reddevils,1g84ky1,0.9,">*“Do you know who the worst one was? Park Ji-sung. He was a nightmare! He was unbelievable. He just used to come up to me, look at me and not say a word, stand right next to me… 'Oh Jesus, here we go!' 'Just say something to me, have a laugh with me!'  But he was unbelievable at it. He just used to come and stare right into my face, stare right into my eyes, ‘You’re not getting a kick today.'”*    

&nbsp; - Paul Scholes


>*“Your job today is not about touching the ball, it’s not about making passes, your job is Pirlo. That’s all. Pirlo.""*    

&nbsp; - Sir Alex Ferguson


>*“[Sir Alex] is a man without blemish, but he ruined that purity just for a moment when it came to me.  A fleeting shabbiness came over the legend that night. At Milan, he unleashed Park Ji-sung to shadow me.  [Park] rushed about at the speed of an electron. He’d fling himself at me, his hands all over my back, trying to intimidate me.  He’d look at the ball and not know what it was for. They’d programmed him to stop me. His devotion to the task was almost touching. Even though he was a famous player, he consented to being used as a guard dog.""*

&nbsp; - Andrea Pirlo


>*""I’m sure Pirlo woke up the next morning, looked at the bottom of his bed and expected to see Ji-sung Park there.  He was that good.”*

&nbsp; - Rio Ferdinand


>*""Sir Alex Ferguson made me man-mark Pirlo...When he had the ball, I tried to prevent him passing the ball in front of him. To mark Pirlo was not easy. It was hard - mentally and physically - but consequently, Milan had a difficult game against us.""*

&nbsp; - Park Ji-sung ❤️"
lsvkldx,reddevils,1g84ky1,-0.5,"He was sat on the row behind him on the flight, he's been marking Pirlo for months and he's not even realised"
lsvl0dx,reddevils,1g84ky1,-0.5,"Fergie never told Ji to stop, I heard Ji was there at Pirlos children’s birthing room."
lsvldav,reddevils,1g84ky1,0.5,Heard Ji parked his car next to Andreas when he arrived 😆
lsvkhrb,reddevils,1g84ky1,-0.5,"Pirlo was a right salty prick about Ji when he was asked a question about him later in his career.

Glad to see somethings never change."
lsw55ki,reddevils,1g84ky1,0.5,What is this from? Tevez at the front and Kaka at the back 🤯
lsvvjf6,reddevils,1g84ky1,0.6,I remember an old SAF interview where he said one of his mistakes was in the 2011 CL Final; not playing Park to mark Messi. Otherwise we may have won. I personally don't think so because that Barca team was monstrous. But thoughts?
lsvpo0f,reddevils,1g84ky1,0.75,This is actually so funny
lsvqcw0,reddevils,1g84ky1,0.6,"Evans still in the starting XI!!  Fletcher, Valencia, park, Johnny proper role players put in a tidy hardworking shift wo a fuss."
lsvl7hr,reddevils,1g84ky1,1.0,Absolute class player
luwvfi3,reddevils,1ghe8dt,1.0,"Thank you for one of the best games I'll ever experience

![gif](giphy|ITOFhIbppykqQ8HmyB|downsized)"
luwrmia,reddevils,1ghe8dt,0.7,Truly wanted him to work. Classy man until the end
luwrzfg,reddevils,1ghe8dt,-0.5,"Thanks for the trophies

Shit it didnt work out how I expected, the appointment was so exciting at the time

Lessons learned and how hopfully with the solid football structure we have in place the next can be a success"
luws142,reddevils,1ghe8dt,-0.5,Wanted it to work so fucking badly.
luwssry,reddevils,1ghe8dt,0.9,"I know many people began to hate him during the end of his tenure here but i never felt that feeling towards him. Sure he was stubborn and so were his press conferences with the constant mention of the two trophies, which we thank him for. But at the end of the day, it was just a man trying his best. 

I also liked how he handled the Sancho and Ronaldo situation. And we wouldn’t be surprised if he found success elsewhere. Best of luck to him."
luwt1my,reddevils,1ghe8dt,0.7,"Say what you want, but he really did love this club. Wish him all the best in his next job"
luwt2j4,reddevils,1ghe8dt,0.9,"That FA Cup win was special. For that alone, he should be greeted warmly if he ever returns to Manchester. All the best in the future Erik!"
luwrn8d,reddevils,1ghe8dt,0.9,No doubt in my mind he will be successful wherever he goes next. He showed so much resilience here. Stay classy boss.
luwtk7t,reddevils,1ghe8dt,0.6,Say anything you want. ETH remained class publicly till the end. He had that class that a Man United manager needs. There is a reason that he didn't lose the dressing room till the end.
luwwu6s,reddevils,1ghe8dt,1.0,That speech before the FA cup final will sit with me forever. Absolutely loved him for doing that. I was ready to run through a brick wall for him
lspcuif,reddevils,1g7ccji,-0.5,head knock caused him to regain consciousness as Ajax De Ligt
lspcrue,reddevils,1g7ccji,1.0,"Having De Ligt, Martinez and Yoro in this defence long term is key 🔥"
lspcgy7,reddevils,1g7ccji,0.0,![gif](giphy|wuhqofLYFGMrJ06eLg|downsized)
lsphrrq,reddevils,1g7ccji,0.9,"Has anyone seen this clip of his reaction when Brentford scored? I love his passion

[https://x.com/MenInBlazers/status/1847661070564888900](https://x.com/MenInBlazers/status/1847661070564888900)"
lspcz1r,reddevils,1g7ccji,0.25,"Such a warrior 💪

https://preview.redd.it/uqvyk9b9nqvd1.jpeg?width=1070&format=pjpg&auto=webp&s=0438d7e259804be0599f729ed62109429b666534"
lspcity,reddevils,1g7ccji,0.9,He was bloody brilliant.
lspd0wk,reddevils,1g7ccji,-0.5,"Weird how Bayern fans considered him to be the best CB at the club. They signed a petition to keep him. But apparently for Scholes it wasn’t an upgrade. For the money we paid for De Ligt, it was a steal"
lspdg39,reddevils,1g7ccji,0.6,"Not saying he is at the same level yet, but the bloody head and warrior-like performance evoked memories of Vidic."
lspiwdb,reddevils,1g7ccji,-0.6,Absolute fucking bargain. You can see why tens of thousands of zee Germans didn't want him to leave.
lspes6j,reddevils,1g7ccji,0.2,He bleeds Red....
ls2di33,reddevils,1g4cch0,0.5,Somehow the least dramatic and most legible Cantona statement.
ls2fc9b,reddevils,1g4cch0,0.0,Has Ferguson voiced any opinion of it?
ls2cdwf,reddevils,1g4cch0,-0.5,Can’t have one normal day at this club can we?
ls2ggpe,reddevils,1g4cch0,1.0,"Whether you’re paying him or not SAF will always be our ambassador, he is the personification of what this club should be. No fan of ManUtd or any club will ever look at him and not think Manchester United and vice versa."
ls2b329,reddevils,1g4cch0,0.2,Oof. Some people are not happy. Can’t say I’m ecstatic but I do think it’s good that we save money and he is still clearly going to be a legend forever
ls2bwfm,reddevils,1g4cch0,-0.5,"It’s really not that deep, ffs. Maybe we can just accept that Fergie was the greatest thing to happen to United post-Busby - probably ever - and that he should not be on a multi-million pound role at the club 10 years after retiring?"
ls3qqf2,reddevils,1g4cch0,-0.75,"Do Ineos not have PR people?

You get ahead of stuff like this and put out a story first ""SAF mutually agrees to forfeit his 2m a year salary to help the club meet PSR rules"". 

You don't just let it leak and be framed by the media as a soulless corporation sacking the club's biggest legend."
ls2blgk,reddevils,1g4cch0,-0.8,Who needs media constantly on our backs when we have a dozen of ex players who are ready to shit on us and stir up drama at every opportunity
ls2looy,reddevils,1g4cch0,-0.75,"Whatever the thoughts about the removal of his salary, INEOS seem absolutely abysmal at PR. Remove his salary, sure, but keep the title or invent some other role for him. It might all be a placebo, but INEOS were positioning themselves as a fan led enterprise who were going bring the soul back to the club after years of Glazer bloodsucking. It feels like completely the opposite thus far."
ls2eoq5,reddevils,1g4cch0,0.5,The one true Eric👑
lujqaiq,reddevils,1gfr0jj,0.7,He looks boss.
lujqqdg,reddevils,1gfr0jj,0.2,Stupid sexy Ruud
lujy0pq,reddevils,1gfr0jj,0.0,"Anyone recognize the fit?

https://preview.redd.it/mwxqkxyxgxxd1.jpeg?width=750&format=pjpg&auto=webp&s=cc00c0ff8f697e424b44ae8d19d5dace88ec5363"
lujpyuj,reddevils,1gfr0jj,0.0,![gif](giphy|pegyrQc6EI1giupnWc|downsized)
lujqchi,reddevils,1gfr0jj,-0.5,How is the mf so much hotter now than he was as a player
lujsvk5,reddevils,1gfr0jj,-0.5,half this thread are people learning about their sexualities
lujqdp1,reddevils,1gfr0jj,0.0,Wtf?!? I didn't realise I was gay until right now
lujr123,reddevils,1gfr0jj,0.5,"Regardless of how his interim spell goes and the lack of job security, he's still a fucking handsome bastard."
lujq86z,reddevils,1gfr0jj,0.2,Dark Vader Ruud is in the house !
lujr383,reddevils,1gfr0jj,0.6,[video of him interacting with fans](https://www.manutd.com/en/videos/detail/ruud-van-nistelrooy-arrives-at-old-trafford-before-first-game-as-interim-head-coach)
lv6f1ry,LiverpoolFC,1gin9tm,1.0,"Does any fan of this club actually want to see this living breathing legend go at the end of this season? Give him an extension, we all want it. Sometimes there is room for sentimentality."
lv6eraa,LiverpoolFC,1gin9tm,0.7,Should give him a new contract.  He's still a top quality player.  Think he wants to stay
lv6el5q,LiverpoolFC,1gin9tm,-0.25,"Maybe it's just the hopium talking, but I feel like this is more of a jab towards the club, urging them to get his contract sorted."
lv6e8a9,LiverpoolFC,1gin9tm,0.5,Please don’t go Mo :(
lv6fpvi,LiverpoolFC,1gin9tm,-0.5,"He's just negotiating , trying to leverage his position. ( If he leaves you will find me floating in the Thames )"
lv6eoxm,LiverpoolFC,1gin9tm,0.5,"Please be leverage, please be leverage, please be leverage…."
lv6e7qn,LiverpoolFC,1gin9tm,-0.3,"Not definitely leaving, but doesn’t sound great…"
lv6f88p,LiverpoolFC,1gin9tm,0.9,I always love when Mo does a bit of a longer message to the fans on social media. He adores this club I have no doubt in my mind
lv6jx5n,LiverpoolFC,1gin9tm,-0.9,"It is November of his last year, and there is no sign from the club. He is our most important player, top scorer and assister and we have nobody in the club who can replace him.

I am ok with Salah putting all the pressure in the world on the club at this point. I will be so so mad if he walks next year, especially if we suffer for it.

The lack of planning for 3 of our top 4 players is malpractice at this point."
lv6fxjb,LiverpoolFC,1gin9tm,0.5,He’s on a mission this season
lv1nbes,LiverpoolFC,1gi16wz,-0.5,Don’t forget Everton losing
lv2l3rp,LiverpoolFC,1gi16wz,0.6,Bro I was watching the game at work and I completely lost it when Salah came in with the kill. Arsenal lost Everton lost and Man City lost. What a good fucking day to be a Liverpool fan LFG
lv1tf0e,LiverpoolFC,1gi16wz,0.2,It was the craziest moment because i went to pee and came back to two goals form Liverpool. I checked the league table and saw that city were 2 nil down.
lv2buu9,LiverpoolFC,1gi16wz,0.2,Proper When I'm Liverpool stuff
lv1o0oi,LiverpoolFC,1gi16wz,0.5,🤣🤣🤣
lv1pu3n,LiverpoolFC,1gi16wz,0.6,Probably the best Vince meme I’ve seen
lv2xmzo,LiverpoolFC,1gi16wz,0.6,A rare occasion where we don’t shoot ourselves in the foot and manage to take advantage of rivals losing.
lv2zp1c,LiverpoolFC,1gi16wz,0.6,Ive never felt a meme more than this
lv3vhpm,LiverpoolFC,1gi16wz,0.6,Liverpool will win the premier league.
lv4nsy7,LiverpoolFC,1gi16wz,0.7,Nottingham Forrest 3 West Ham 0 is this seasons highlight.
lrfbc49,LiverpoolFC,1g1ceat,1.0,"2x Carabao Cup 🏆🏆
1x Premier League 🏆
1x Champions League 🏆
1x FA Cup 🏆
1x UEFA Super Cup 🏆
1x Community Shield 🏆

Man of the Match in the 2019 Champions League final, with an assist to boot. 😮‍💨"
lrfbobi,LiverpoolFC,1g1ceat,0.6,that goal vs leeds 🥹 our favourite adventurous giraffe
lrg1u2k,LiverpoolFC,1g1ceat,-0.6,"The mad cunt didn’t even announce his retirement. We only found this out because Hamburg tried to sign him and his agent said he’s not a player anymore. 

Classic, Joel."
lrfdra9,LiverpoolFC,1g1ceat,0.6,"https://preview.redd.it/zzsr5hgdd5ud1.jpeg?width=1170&format=pjpg&auto=webp&s=4a8f4ea2158dcc46390a06b518572f3b7304fcc6

Wish i could hold him like this to thank him for everything"
lrfb6f7,LiverpoolFC,1g1ceat,0.2,"Footballer.

Giraffe.

King."
lrffz7f,LiverpoolFC,1g1ceat,0.0,https://preview.redd.it/vp380bomf5ud1.jpeg?width=859&format=pjpg&auto=webp&s=69f2fe3167c214f4fb007bb767070883bb4debba
lrfe4n7,LiverpoolFC,1g1ceat,1.0,I used to love when he’d take the ball and drive forward like a mad fucking giraffe.  Unstoppable.   Love the guy.
lrfe0mh,LiverpoolFC,1g1ceat,0.0,![gif](giphy|wPGHrR1uIZb0pvaJXv|downsized)
lrfbjtt,LiverpoolFC,1g1ceat,0.0,![gif](giphy|bhPbeR71ttD3iIwWX4|downsized)
lrfitox,LiverpoolFC,1g1ceat,1.0,"He’s came from Schalke with 0 trophies to become one of the best partner with VVD and won all the trophies in hardest league. Will never forget his solo runs, man had a balls made of steel. Thank you Matip."
lvkrcvj,LiverpoolFC,1gkff6g,0.5,Beautiful bastard
lvku3s7,LiverpoolFC,1gkff6g,0.5,"Two major problems I have with Xabi Alonso: 1. my wife fancies him (I don’t blame her though, tbf), 2. he’s not actually ageing! He could still be putting in a shift in midfield by the looks of him."
lvkqp8j,LiverpoolFC,1gkff6g,0.9,Legend❤️
lvkru2j,LiverpoolFC,1gkff6g,0.0,![gif](giphy|NCjISbEPFxm48)
lvkrvrq,LiverpoolFC,1gkff6g,0.5,He's allowed.
lvkvw3o,LiverpoolFC,1gkff6g,0.5,"You handsome ass man, you can touch anything you want.

![gif](giphy|149uFgfuvDfDCo)"
lvksucz,LiverpoolFC,1gkff6g,0.6,"Xabi has respect for the reds, that's all that matters....now he will lose.![gif](emote|free_emotes_pack|grin)"
lvkvhtv,LiverpoolFC,1gkff6g,0.3,"He earned the right. 

Has an opposition manager ever done this before?"
lvkrhml,LiverpoolFC,1gkff6g,-0.5,"Fuck you xabi I hope you loose 


No but seriously I love you"
lvkwy26,LiverpoolFC,1gkff6g,0.5,"I just got in touch with my scouse ex to say “DID HE JUST TOUCH THE SIGN!?!” and she responded. 

He’s brought us back into each other’s lives.

What a man."
lqwr4c0,LiverpoolFC,1fyucha,1.0,"Love the fact he stuck to his word that he would leave the club in the best position possible when he left. 
Left us with a squad that can still compete for everything, forever thankful for Jurgen"
lqwsxpw,LiverpoolFC,1fyucha,0.5,"The day he left, he looked better. The job really took its toll on him. For that I would give him endless thanks."
lqwp423,LiverpoolFC,1fyucha,0.6,# #InKloppWeTrust
lqwwi5i,LiverpoolFC,1fyucha,0.85,"https://preview.redd.it/jd6v9sqa2itd1.jpeg?width=3024&format=pjpg&auto=webp&s=369884aba9e316c753e739b6f4b76296c7ad63d2

I visited klopp museum at anfield last weekend. It was emotional! Bless that man"
lqwwdzv,LiverpoolFC,1fyucha,0.0,https://preview.redd.it/qwcatr952itd1.jpeg?width=1080&format=pjpg&auto=webp&s=c4231f330c897e4a5cf9ffa989980ca64ca158cc
lqwrlfa,LiverpoolFC,1fyucha,1.0,I am so glad Jurgen is a red
lqwvp1s,LiverpoolFC,1fyucha,0.0,![gif](giphy|WV3if1rJykgbku0zq1)
lqwqhna,LiverpoolFC,1fyucha,1.0,YNWA Jurgen
lqwvfgd,LiverpoolFC,1fyucha,0.7,I miss Kloppo but I love Slot too. We're blessed with our managers
lqwzv9l,LiverpoolFC,1fyucha,1.0,"Never connected with a manager of our club as much. Probably never will again in my lifetime. His personality, his values, culture, his humour, his aura - everything just fully aligned with everything that our club is about and stands for. Always seemed to say the right things in the right moments, never afraid to say what he thought, criticised when he needed to, stood up for the club, the players, the fans when he needed to and showed passion and empathy by the bucket load. Special, special man. Genuinely forever greatful."
lravsr5,chelseafc,1g0r7dk,0.0,How many champions league Trophies Zlatan?
lrax630,chelseafc,1g0r7dk,-1.0,"![gif](giphy|7NIucnGmJii0xVYqbS)

Something you’ll never have Ibra you bell end."
lravpcj,chelseafc,1g0r7dk,1.0,Beautiful stuff JT!
lrb2pfh,chelseafc,1g0r7dk,-1.0,"![gif](giphy|XEdgJpPEZPDqI2HVm3|downsized)

Something Chelsea have done twice and Ibra has never been a part of…"
lrawf0s,chelseafc,1g0r7dk,0.2,Ibra try not to say something corny challenge (impossible)
lrav6uu,chelseafc,1g0r7dk,0.2,![gif](giphy|9uoYC7cjcU6w8|downsized)
lrav6xy,chelseafc,1g0r7dk,-1.0,Thundercunt 💙
lravust,chelseafc,1g0r7dk,0.5,Congrats on all your really challenging French trophies
lrb06dw,chelseafc,1g0r7dk,0.7,"When JT speaks, we listen. Captain is right. Drogba is and will always be 👑."
lrb10bk,chelseafc,1g0r7dk,-0.75,"Then he went to United to win what? lmao. Bro couldn’t cut it in the Prem, even late 30s Ronaldo did better."
lv7vyvq,chelseafc,1gitloh,0.9,Him and Palmer absolutely deserve to be playing CL football.
lv7wgl7,chelseafc,1gitloh,-0.7,"He's been playing like this for nearly a year.

Sadly the price tag, rejecting Liverpool and not being Declan Rice put a target on his head."
lv7vi06,chelseafc,1gitloh,0.75,"Nobody is talking about the price tag anymore 

Quality player"
lv7yw7n,chelseafc,1gitloh,0.5,Caicedo is the player the English media hype Rice to be.
lv7v8yq,chelseafc,1gitloh,0.5,Unreal
lv7vftb,chelseafc,1gitloh,0.5,Thank God we have him.
lv7vmil,chelseafc,1gitloh,0.7,Dude can do it all!
lv7w8sq,chelseafc,1gitloh,0.6,"Midfield general

Probably the best midfielder in the league this season.

And now he has scored a goal so we will start getting praised for him since most of the pundits just looked at stats."
lv7vb9r,chelseafc,1gitloh,0.5,Worth every pound
lv7vknk,chelseafc,1gitloh,-0.5,Atleast we have 1 over Brighton
lv2m3a7,chelseafc,1gi5fi9,-0.5,Literally disgusting on him. What a legend
lv2ov2q,chelseafc,1gi5fi9,0.2,proper chels
lv2v9ak,chelseafc,1gi5fi9,0.5,"What I love so much about Hazard is that he almost didn't even care (not in the bad way) about football and was practically out there having fun, unbothered 

yet he still hates Spurs"
lv2qp7q,chelseafc,1gi5fi9,-1.0,"Hope they used that shirt to clean up all the hair on the floor.

And then clean the toilets while they’re at it."
lv2owwb,chelseafc,1gi5fi9,-0.9,Must have been disgusted. I know I would have been
lv2y48n,chelseafc,1gi5fi9,0.2,There are lines that should never be crossed.
lv2s54e,chelseafc,1gi5fi9,0.25,You could see that he wasn't okay with the joke - on his facial expression. It just shows how attached he is to Chelsea and how much he HATES TOTTENHAM.
lv2x1nc,chelseafc,1gi5fi9,0.2,"I love how much he's still committed to it. 

As much as I hate that it happened to him of all people, I still rub it in the face of all the RM fans I know that he never worked out for them"
lv2q1kp,chelseafc,1gi5fi9,-0.8,Throw away that disgusting thing.
lv2w30a,chelseafc,1gi5fi9,0.5,It would’ve Been funnier if it was Willian 😂
ls14sq1,chelseafc,1g46pln,0.5,That’s pretty neat. Glad to see the proper badge in the proper spot. Miss him still.
ls17p3f,chelseafc,1g46pln,0.9,And Chelsea badge is at its rightful place 💙💙💙
ls17nqq,chelseafc,1g46pln,0.1,Wearing the correct badge.
ls19qpd,chelseafc,1g46pln,0.5,"of course we get the badge spot, he's OUR legend, it's only right"
ls1cuns,chelseafc,1g46pln,0.6,The most important part of this Jersey is showing the badge
ls14z7k,chelseafc,1g46pln,0.6,"I'm actually shocked at how not ugly that thing looks.

The shirt that is, not Eden. He's beautiful."
ls1bgkb,chelseafc,1g46pln,-0.3,Genuinely impressed he hasn't already ballooned like Wesley Sneijder post retirement.
ls17rbx,chelseafc,1g46pln,0.6,"Every month or so I watch a different YT video of Edens highlights (even though they’re the same clips).  I can’t get enough of him, he was different gravy."
ls19yur,chelseafc,1g46pln,0.5,Legend
ls1y2f0,chelseafc,1g46pln,0.2,He's only 33 btw.
lu12wkc,chelseafc,1gdesoa,0.5,"Maresca called for him to rise to the moment as a leader and Reece was immense. Reece deserves all the credit for how well he played, but Maresca deserves some credit, too. A not insignificant amount of people thought he was pushing the wrong buttons, but it looks like he got the result he was pushing for from his captain."
lu12jon,chelseafc,1gdesoa,0.5,With a MOTM level performance too
lu12i22,chelseafc,1gdesoa,0.9,I was very surprised he didn’t come off sooner. Played a great match
lu12r2x,chelseafc,1gdesoa,0.7,"My captain. Brings some kind of physicality and poise which isn't present in our other full backs. Both as an LB and as an RB.

He's one of the main reasons we won."
lu12a1b,chelseafc,1gdesoa,0.6,The inverted full back might be his best position. Don’t have to put lung bursting runs into the final third and still ping long balls around and dictate play.
lu1401e,chelseafc,1gdesoa,0.5,He is gonna do a full Ramos/Maldini and go from Fullback to CB
lu12jdt,chelseafc,1gdesoa,0.6,Heroic game
lu12vhp,chelseafc,1gdesoa,1.0,So calm on the ball. Love watching this man play football
lu1725g,chelseafc,1gdesoa,0.0,![gif](giphy|11Un64tF2yX8JO)
lu14o4v,chelseafc,1gdesoa,0.5,"He did a great job playing on both sides LB and RB.I think he should start now James and Marc cucu , i know Malo gusto has been good with team but just imagine if James had those chances that Malo missed in this game."
ls7z5as,Gunners,1g537ub,0.5,"*It’s toasted*

https://i.redd.it/ws9c7sw4a5vd1.gif"
ls80d1w,Gunners,1g537ub,0.0,![gif](giphy|xT1R9REkSiimHh1vCE|downsized)
ls80lq5,Gunners,1g537ub,-0.5,I respect the dedication to stick to smoking 😭😭😭
ls81ynt,Gunners,1g537ub,0.5,Cracks me up how he's just come out of retirement and doesn't give a shit
ls84rgw,Gunners,1g537ub,0.5,Fun fact: 19 year old Woj was named Brentford’s goalkeeper of the decade after his season long loan in 2009.
ls83z49,Gunners,1g537ub,0.5,Is this real? 😀
ls7zyi9,Gunners,1g537ub,0.0,![gif](giphy|l8aCBaBuz5R6M|downsized)
ls82uly,Gunners,1g537ub,0.2,I never thought I'd be so proud to see someone smoke 🥹
ls83142,Gunners,1g537ub,-0.5,*what are they smoking over there?*
ls842h0,Gunners,1g537ub,-0.5,Smoking that Arshavin winner celebration pack
lsja5sq,Gunners,1g6juki,0.5,"Mikel Arteta, he's done it again."
lsjbxj5,Gunners,1g6juki,-0.5,"She had been complaining about his time wasting, so he just got it over with."
lsja5ty,Gunners,1g6juki,0.5,"It was only a matter of time after officially joining the Arsenal, Artetas done it again"
lsjah8u,Gunners,1g6juki,-0.5,No clean sheets tonight then!
lsjd941,Gunners,1g6juki,0.5,"Marriage FC. I’m telling you, this is Arteta’s aim!"
lsja5g7,Gunners,1g6juki,0.1,Post all your 'keeper' jokes here
lsjb2v6,Gunners,1g6juki,1.0,"Been some start to the season this for raya. Been best gk in the league, back to back clean sheets for Spain, now this. Brother must be mentally on cloud 9. Happy for him"
lsja5ij,Gunners,1g6juki,0.75,"well, he is a keeper after all"
lsjcd84,Gunners,1g6juki,0.6,Another good catch by Raya.
lsj9ibf,Gunners,1g6juki,-0.5,Welcome to the wife swapping league.
luiq1ed,Gunners,1gfmpni,0.7,That's the mindset. Never underestimate an opponent.
luir7v7,Gunners,1gfmpni,-0.5,"None of those clubs have ever gone invincible, Preston have. They're bigger than all 3 combined"
luisyug,Gunners,1gfmpni,0.9,Invincible derby. Preston will always have my respect
luisbor,Gunners,1gfmpni,0.5,Elite mentality.
luis36v,Gunners,1gfmpni,0.7,Elite mentality. Stay humble king
luiti74,Gunners,1gfmpni,0.2,The captain can’t take any matches lightly.
luiqqmp,Gunners,1gfmpni,-0.5,Alot of traveling. Preston is like beyond Manchester.
luivdng,Gunners,1gfmpni,0.6,Charile Patino influence unmatched
luizdn6,Gunners,1gfmpni,0.2,"It’s the main game. Preston away is a great excuse for a random Blackpool trip. 

The fuck can people do in Milan when you have Blackpool so close."
luirze7,Gunners,1gfmpni,0.5,"After underestimating Bournemouth, Preston is no joke tbf. Can’t afford to drop anymore points though so hopefully we see some good performances for today and November"
lrkth47,Gunners,1g22cmn,0.3,Absolute wand of a left foot. Sometimes.
lrkum3w,Gunners,1g22cmn,0.8,I wanted him to succeed so bad
lrkrxc2,Gunners,1g22cmn,-0.5,Pepe is unlucky there’s no Anthony or mudryk in pl in his time otherwise people would not shit on him as badly as they did
lrku3v8,Gunners,1g22cmn,0.5,"Just wish we weren't going through such turmoil when he joined. Still think he was a decent player. 

In many ways you can argue his tenure was percieved so bad due to things almost all of which were out of his control. Club in turmoil, manager who didn't really want him, his price tag, an absolute wizard springing from hale end in his position."
lrkwpa9,Gunners,1g22cmn,0.6,Anyone remember that game vs Wolves. It was right after AFCON 2022. He came on late in the second half & single handedly changed the game. Mikel said he had a future at the club if he kept playing like that.
lrkt67z,Gunners,1g22cmn,0.9,His disallowed goal vs Chelsea was filthy!
lrkrjd0,Gunners,1g22cmn,-0.5,"Man hated scoring simple goals, didn't he."
lrktgy2,Gunners,1g22cmn,-0.4,Holy shit I forgot about some of these. Some WORLDIES
lrkvrh0,Gunners,1g22cmn,0.9,That goal against Wolves was my favourite.
lrky4wp,Gunners,1g22cmn,-0.5,Excluding penalties only one of them wasn't a banger
lqx1p7g,Gunners,1fywbkq,1.0,Tomiyasu was such a good fucking sub in that game. Brilliant from Arteta.
lqx1l8g,Gunners,1fywbkq,0.6,"Everytime I see this, my fav part is Tomis calmness and awareness to cushion that header. Wish he could stay fit"
lqx4bdh,Gunners,1fywbkq,-0.2,Need Big Gabby to crush a ball into the net off of Haaland's face next game.
lqx4crz,Gunners,1fywbkq,0.9,"Watching this again, I’m almost certain this entire move was rehearsed on the training ground. Which again reminds me how elite Mikel and the coaching staff are, planning for every scenario and trying to take advantage of every marginal gain."
