id,subreddit,submission_id,score,comment_body
lv2nrxg,NUFC,1gi43or,0.5,"As Carly Rae Jepson once said Bruno, 

I really really really really really really  like you"
lv2bm7t,NUFC,1gi43or,0.3,🥺
lv1x3gq,NUFC,1gi2ald,-1.0,Sven Botman
lv1xen3,NUFC,1gi2ald,-0.5,J7 and his veins. Inject it
lv1yce8,NUFC,1gi2ald,0.5,"I always play, where's Eddie? Always at the back, smiling"
lv1wum3,NUFC,1gi2ald,0.7,"Get some rest lads, we'll deserved."
lv3zm41,NUFC,1gi2ald,0.7,"I love how Tonali was just so *up for it*. He came on with the attitude ""I'm going to fucking smash it and anyone who gets in our way."""
lv208an,NUFC,1gi2ald,0.2,Will Osula West Side represent
lv1wofr,NUFC,1gi2ald,0.6,Fucking love to see it.
lv2cf5o,NUFC,1gi2ald,-0.5,What’s going on with Targett? Seeing the photo has reminded me that he’s alive.
lv2qzzn,NUFC,1gi2ald,0.2,Like buses etc
lv2zpzg,NUFC,1gi2ald,0.6,Haven’t been spoiled this much since the ambassador bust out the Ferrero Rocher
lrqdu0y,NUFC,1g2rlcn,-0.5,Sunlun get battered...
lrq8vnw,NUFC,1g2rlcn,0.5,Lads and lasses do the double on those lot. Get in!
lrrunhm,NUFC,1g2rlcn,0.2,Stadium of light work
lrrv6gu,NUFC,1g2rlcn,0.7,17k I saw at one point watching on YouTube. Great turnout
lrqc3x7,NUFC,1g2rlcn,0.2,Mullered em
lrqf0bb,NUFC,1g2rlcn,-0.8,Stadium of Lights always an easy away win like
lrqtvxl,NUFC,1g2rlcn,0.2,Get in Lasses ⚫️⚪️
lrram1a,NUFC,1g2rlcn,0.5,Highlights anywhere to watch?
lrujnnn,NUFC,1g2rlcn,0.7,Was there yesterday and Newcastle fans did their team proud. Fantastic noise for their team while Sunderland fans were very quiet.
lrsdy6o,NUFC,1g2rlcn,1.0,"The attendance at the match was 15,387 which set the record attendance for the Barclays Women’s Championship.  In all reality we might sell out the return fixture.  It’s fantastic!"
lt6xafu,NUFC,1g9lv3o,0.6,Hopefully this being sorted is a weight off his mind and a catalyst for him to kick in after a poor start by his standards.
lt6xn2l,NUFC,1g9lv3o,0.9,"Great news, hopefully it helps him settle down a bit and we can get the Gordon of last season back."
lt6xx6m,NUFC,1g9lv3o,0.5,[club website](https://www.newcastleunited.com/en/news/anthony-gordon-signs-new-long-term-contract)
lt8fp42,NUFC,1g9lv3o,0.6,As a newer fan I have been debating which player's shirt I wanted. Gordon it is. Sending winning vibes from the States 🍻
lt73nxz,NUFC,1g9lv3o,0.7,I wonder if there is a release clause? I hope not Gordon is unapologetically ambitious and him signing without one would be a super positive signal about the direction of the club
lt7esc5,NUFC,1g9lv3o,0.2,"Isak next, please,"
lt70aav,NUFC,1g9lv3o,0.9,Great news.
lt74hdg,NUFC,1g9lv3o,0.5,Very interesting background for his interview
lt75nxv,NUFC,1g9lv3o,0.9,Ahhh finally some good news!!
lt761js,NUFC,1g9lv3o,0.5,he talks about meeting the girl who is sick in his interview - that was done a few weeks ago right? So presumably this contract has been in place for some time..?
